{"schema_version":1,"compiler_version":"xconnect-acl-v1alpha1.1","network_id":"network-golden","revision":7,"default_action":"deny","protected_flows":["control:controller-session","control:gateway-apply-result","control:gateway-heartbeat","control:gateway-policy-artifact","control:gateway-snapshot"],"rules":[{"id":"allow-api","action":"accept","source_devices":["dev-a"],"destination_devices":["dev-b"],"protocols":["tcp"],"ports":[8787]}]}
